{
  "schemaVersion": "v5-public-trust-receipt-v1",
  "publicReceiptId": "e2f93e7c5bf148cf0da534ff5d78cfbd7d844509f22630db31272cf933eaaedd",
  "issuedAt": "2026-03-01T00:00:00.000Z",
  "disclosure": {
    "receiptKind": "memory_admission_receipt",
    "decision": "allow",
    "verdict": "allow",
    "status": "admitted",
    "riskScore": 0,
    "trustPolicyVersion": "0.8.0",
    "createdAt": "2026-01-01T00:00:00.000Z"
  },
  "binding": {
    "internalReceiptHash": "3c8bfe7d26e9ede5ca31d0e1398b7284ab8876e00cc67dbec67608b791922ac6",
    "bundleHash": "26244bb0512992b0078504864d698a9c5876fd5a5e12ffc7439b68b55fcc7d03"
  },
  "integrity": {
    "checksumAlgorithm": "sha256-canonical-json-v1",
    "checksum": "cac0f6c54573274b395d0e9e78b9e2168a66a8fbb3b8e46778887dc67d5801a2",
    "signed": false,
    "signature": null
  }
}
